{
  "id": "a1b2c3d4-e5f6-7890-abcd-ef1234567890",
  "actor": {
    "objectType": "Agent",
    "account": {
      "homePage": "https://lms.institution.ac.za",
      "name": "stu-f7a3b2c1"
    }
  },
  "verb": {
    "id": "https://brindlewaye.com/xAPITerms/verbs/loggedin",
    "display": { "en": "logged in" }
  },
  "object": {
    "objectType": "Activity",
    "id": "https://lms.institution.ac.za/sessions/2026-03-08T09-15-00Z/stu-f7a3b2c1",
    "definition": {
      "type": "https://w3id.org/xapi/aclit/v1/activity-types/session",
      "name": { "en": "Learning Session 2026-03-08T09:15:00Z" },
      "description": { "en": "Student login session starting at 2026-03-08T09:15:00Z" }
    }
  },
  "context": {
    "registration": "b2c3d4e5-f6a7-8901-bcde-f12345678901",
    "extensions": {
      "https://w3id.org/xapi/aclit/v1/extensions/device-type": "smartphone",
      "https://w3id.org/xapi/aclit/v1/extensions/connection-type": "mobile-data"
    },
    "contextActivities": {
      "grouping": [
        {
          "objectType": "Activity",
          "id": "https://lms.institution.ac.za/courses/aclit-2026",
          "definition": {
            "type": "http://adlnet.gov/expapi/activities/course",
            "name": { "en": "Academic Literacies 2026" }
          }
        },
        {
          "objectType": "Activity",
          "id": "https://lms.institution.ac.za/courses/aclit-2026/modules/03",
          "definition": {
            "type": "http://adlnet.gov/expapi/activities/module",
            "name": { "en": "Module 3: Academic Register" }
          }
        }
      ],
      "category": [
        {
          "objectType": "Activity",
          "id": "https://w3id.org/xapi/aclit/v1",
          "definition": {
            "type": "http://adlnet.gov/expapi/activities/profile",
            "name": { "en": "Academic Literacies Learning Analytics Profile" }
          }
        }
      ]
    }
  },
  "timestamp": "2026-03-08T09:15:00Z"
}
